{
  "record_type": "alert-envelope",
  "protocol_version": "0.1",
  "alert_id": "CT-ALERT-DEMO-0001",
  "cap_identifier": "example-authority-20260823-0001",
  "language": "en",
  "source": {
    "id": "EXAMPLE-AUTHORITY",
    "name": "Example Emergency Authority",
    "registry_reference": "synthetic-fixture-only",
    "source_reference": "https://example.com/alerts/CT-ALERT-DEMO-0001"
  },
  "source_status": "official-registered",
  "integrity_status": "verified",
  "sent_at": "2026-08-23T18:00:00Z",
  "effective_at": "2026-08-23T18:00:00Z",
  "expires_at": "2099-08-24T03:00:00Z",
  "event": "Extreme Heat Warning — Synthetic Demo",
  "severity": "Severe",
  "urgency": "Expected",
  "certainty": "Likely",
  "area_description": "Example District — documentation fixture only",
  "description": "Synthetic alert used to test CrisisTrust. It does not describe a real emergency.",
  "instruction": "Follow the instructions of your local emergency authority. This sentence is synthetic test content and is not real-world emergency guidance."
}